,,,,,,,,,,,,,Derivative Rights,,Ancillary Rights,,Nature of Rights,,,,Details of Film,,,,,,,,,,,,,,,,,
Movie Name,,,,Primary Rights,,,,Secondary Rights,,Holdbacks,Clip Rights,Duration,Prequel/ Sequel Rights,Character Rights,Sub-Titling Rights,Dubbing Rights,Nature of Satellite Rights,Nature of Internet Rights,Nature of Negative Rights,Nature of Other Rights,Territory,Cast Details,Director,Release Year,Certification,Color/B/W,Agreement Start Date,Agreement End Date,Satellite Rights Start Date,Satellite Rights End Date,Internet Rights Start Date,Internet Rights End Date,Negative Rights Start Date,Negative Rights End Date,Other Rights Start Date,Other Rights End Date,Syndication- Internet Rights (Y/N),
,Assignor/ Licensor,Licensee,Date of Agreement,Satellite Rights,Internet Rights,Negative Rights,Other Rights,Satellite Rights Classification,Internet Classification,,,,,,,,,,,,,,,,,,,,,,,,,,,,,
Aaghat,Jalan Distributors,SVF,15-Apr-17,Yes,Yes,,,"Cable TV, Pay Rights, DTH","SVOD, AVOD, FVOD, TVOD, NVOD, IPTV",,,,No,No,Yes,No,Exclusive,Exclusive,,,World,"Rituparna Sengupta, Prosenjit Chatterjee, June Maliya",Anup Sengupta,2001,U,Color,15-Apr-17,14-Apr-27,15-Apr-17,14-Apr-27,15-Apr-17,14-Apr-27,,,,,Yes,
Bela Seshe,Bengali Productions Pvt Ltd,SVF,1-Jan-15,Yes,Yes,Yes,Yes,"Pay TV, Free TV, DTH","SVOD, AVOD, FVOD",on Theatrical,Yes,2 minutes,No,No,Yes (Bengali),Yes (Bengali),Exclusive,Exclusive,Exclusive,Exclusive,India,"Soumitra Chatterjee, Rituparna Sengupta","Nandita Roy, Shiboprosad Mukherjee",2015,UA,Color,1-Jan-15,Perpetual,1-Jan-15,Perpetual,1-Jan-15,Perpetual,1-Jan-15,Perpetual,1-Jan-15,Perpetual,Yes,
Chander Pahar,Adventure Films Ltd,SVF,10-Mar-13,Yes,Yes,,,,"SVOD, AVOD, TVOD",,No,,No,No,Yes (Bengali),No,Exclusive,Non-Exclusive,,,World,"Dev, Saayoni Ghosh",Kamaleshwar Mukherjee,2013,U,Color,10-Mar-13,9-Mar-33,10-Mar-13,9-Mar-23,10-Mar-13,9-Mar-33,,,,,Yes,
Agnisakshi,Shree Maa Productions,SVF,18-Jan-11,,,Yes,,,"SVOD, AVOD, FVOD, TVOD, NVOD, IPTV","on Audio Rights, Theatrical Exploitation",,,,Yes,Yes,Yes (Bengali),Yes,,,Exclusive,World,"Soumitra Chatterjee, Santanupa Bose",Dipankar Bhattacharya,18-Jan-11,U,Color,18-Jan-11,Perpetual,N/A,N/A,N/A,N/A,18-Jan-11,N/A,18-Jan-11,Perpetual,Yes
Abhinetri,Echo Entertainment,SVF,31-Dec-18,,Yes,,,,"AVOD, FVOD, SVOD, TVOD, IPTV",,,,No,No,No,No,,Exclusive,,,,"Tapas Paul, Satabdi Roy",Satabdi Roy,,,,31-Dec-18,30-Dec-21,N/A,N/A,N/A,N/A,,,,,Hoichoi only,
Toofan,Alpha I Studios Limited,SVF,15-May-24,Yes,Yes,,Airborne Rights,"Cable TV, DTH, IPTV, VOD, Pay Rights",SVOD,,Yes,,No,No,"Yes (Bengali, English)",Yes (Hindi),Exclusive,Exclusive,,Exclusive,World,"Shakib Khan, Mimi Chakraborty",Raihan Rafi,2024,A,Color,17-Sep-24,Perpetual,17-Dec-24,Perpetual,17-Sep-24,Perpetual,,,,,Yes,
